{
  "artifacts": [],
  "capability_profile": {
    "adapter": {
      "id": "frameshift.generic",
      "version": "0.1.0"
    },
    "capabilities": [
      {
        "approval": "never",
        "available": true,
        "data_classes": [
          "user-provided"
        ],
        "id": "artifact.read",
        "limitations": [
          "Only artifacts provided in the current context."
        ],
        "operations": [
          "read-inline"
        ],
        "side_effect": "none",
        "version": "1"
      }
    ],
    "profile_id": "generic-conversation-only",
    "schema_version": "1.0.0"
  },
  "checkpoint_digest": "sha256:6048f794c1463a5f94d7e4b501a054ae725bbcb5e2fa9ba498f32108458f1580",
  "contracts": {
    "engines": {
      "problem_framing": "1.0.0"
    },
    "prompts": {
      "problem_framing": {
        "digest": "sha256:bb57c98a14c2fd82ae287787c19cc079266a28160650326df33daf2cd685bea2",
        "id": "frameshift.problem-framing.v2",
        "version": "2.0.0"
      }
    }
  },
  "created_at": "2026-10-06T09:00:00Z",
  "event_cursor": 15,
  "execution_summaries": [],
  "id": "ckpt_withdrawal_001",
  "pending_proposals": [],
  "phase": "framing",
  "prior_checkpoint_digest": null,
  "prompt_version_changes": [],
  "schema_version": "2.0.0",
  "session_id": "sess_withdrawal_001",
  "session_revision": 8,
  "state": {
    "active_frame_id": "frame_001",
    "approvals": [
      {
        "actor": {
          "id": "user_lead_eng",
          "kind": "human",
          "role": "decision_owner"
        },
        "created_at": "2026-10-06T09:00:00Z",
        "disposition": "approved",
        "id": "appr_confirm_t0004",
        "profile_id": "approval-profile-frameshift-manual-gui-local-0.1.0",
        "session_revision": 2,
        "target_digest": "sha256:619e0d3cc5ce615fe3bab79ea981b458a23ffc4a881da07f0321d89412ab6c37",
        "target_id": "stmt_001"
      }
    ],
    "criteria": [],
    "frames": [
      {
        "abstraction_level": "product",
        "assumptions": [],
        "constraints": [],
        "digest": "sha256:46409c3a8094e11f74ee1b7e8aa0affaee9f45d2457e2ec5e6f37815daec5ec7",
        "excluded": [],
        "id": "frame_001",
        "included": [
          "cell sourcing",
          "pack architecture"
        ],
        "open_questions": [],
        "outcome": "Pack cost per usable kWh meets the 2027 target.",
        "question": "How might we reach the pack cost target without losing range?",
        "status": "working",
        "success_measures": [
          "USD per usable kWh"
        ],
        "system_boundary": "supply_chain"
      },
      {
        "abstraction_level": "product",
        "assumptions": [],
        "constraints": [],
        "digest": "sha256:77d4b767878bddff37216add79fd15012eb76ec1c8a006d5ea54aae562af1283",
        "excluded": [],
        "id": "frame_002",
        "included": [
          "cell sourcing",
          "pack architecture"
        ],
        "open_questions": [],
        "outcome": "Pack cost per usable kWh meets the 2027 target.",
        "question": "The same frame, asked another way?",
        "status": "rejected",
        "success_measures": [
          "USD per usable kWh"
        ],
        "system_boundary": "supply_chain"
      },
      {
        "abstraction_level": "business",
        "assumptions": [],
        "constraints": [],
        "digest": "sha256:4674e151fd9937ef246b745ee2f6ab85d83523ab76b27f4d41d048a62ed204d5",
        "excluded": [],
        "id": "frame_003",
        "included": [
          "cell sourcing",
          "pack architecture"
        ],
        "open_questions": [],
        "outcome": "Pack cost per usable kWh meets the 2027 target.",
        "question": "How might we lower the cost of a usable kWh across the pack's whole life?",
        "status": "proposed",
        "success_measures": [
          "USD per usable kWh"
        ],
        "system_boundary": "lifecycle"
      }
    ],
    "graph": {
      "edges": [],
      "nodes": [],
      "schema_version": "1.0.0"
    },
    "id": "sess_withdrawal_001",
    "options": [],
    "phase": "framing",
    "revision": 8,
    "schema_version": "2.0.0",
    "statements": [
      {
        "id": "stmt_001",
        "primary_role": "proposal",
        "provenance": {
          "kind": "observed",
          "source_ids": [
            "intake_t0001"
          ]
        },
        "secondary_roles": [
          "need"
        ],
        "status": "proposed",
        "text": "Switch the pack to prismatic cells so we hit the cost target."
      },
      {
        "id": "stmt_002",
        "primary_role": "outcome",
        "provenance": {
          "kind": "observed",
          "note": "Typed by the operator during intake.",
          "source_ids": [
            "intake_t0003"
          ]
        },
        "secondary_roles": [],
        "status": "proposed",
        "text": "Pack cost per usable kWh meets the 2027 target."
      }
    ],
    "status": "active",
    "title": "Pack cost per kWh at the 2027 volume step",
    "workspace_id": "ws_local"
  },
  "state_digest": "sha256:37fb637876a6bef0b4e020af7e6b50c0f8eb59c277d776073491a0cdf7cfa401"
}
