{
  "schema_version": "2.0.0",
  "id": "ckpt_prompt_identity_001",
  "session_id": "sess_prompt_identity_001",
  "session_revision": 1,
  "phase": "framing",
  "state": {
    "schema_version": "2.0.0",
    "id": "sess_prompt_identity_001",
    "workspace_id": "ws_reference",
    "title": "Prompt identity preservation",
    "status": "active",
    "phase": "framing",
    "revision": 1,
    "active_frame_id": null,
    "statements": [],
    "frames": [],
    "graph": {
      "schema_version": "1.0.0",
      "nodes": [],
      "edges": []
    },
    "options": [],
    "criteria": [],
    "approvals": []
  },
  "pending_proposals": [],
  "event_cursor": 1,
  "prior_checkpoint_digest": null,
  "contracts": {
    "engines": {
      "problem_framing": "1.0.0"
    },
    "prompts": {
      "problem_framing": {
        "id": "frameshift.problem-framing.v2",
        "version": "2.0.0",
        "digest": "sha256:bb57c98a14c2fd82ae287787c19cc079266a28160650326df33daf2cd685bea2"
      }
    }
  },
  "capability_profile": {
    "schema_version": "1.0.0",
    "profile_id": "generic-conversation-only",
    "adapter": {
      "id": "frameshift.generic",
      "version": "0.1.0"
    },
    "capabilities": [
      {
        "id": "artifact.read",
        "version": "1",
        "operations": [
          "read-inline"
        ],
        "side_effect": "none",
        "approval": "never",
        "available": true,
        "data_classes": [
          "user-provided"
        ],
        "limitations": [
          "Only artifacts provided in the current context."
        ]
      }
    ]
  },
  "artifacts": [],
  "execution_summaries": [
    {
      "execution_id": "exec_prompt_v1_001",
      "engine": "problem_framing",
      "prompt_contract": {
        "id": "frameshift.problem-framing.v1",
        "version": "1.0.0",
        "digest": "sha256:9e689e62ff90cc33cf2b520dba9730cd45578ba8898e1a9270b31e94cf7f4951"
      }
    },
    {
      "execution_id": "exec_prompt_v2_001",
      "engine": "problem_framing",
      "prompt_contract": {
        "id": "frameshift.problem-framing.v2",
        "version": "2.0.0",
        "digest": "sha256:bb57c98a14c2fd82ae287787c19cc079266a28160650326df33daf2cd685bea2"
      }
    }
  ],
  "prompt_version_changes": [
    {
      "id": "prompt_change_001",
      "engine": "problem_framing",
      "from": {
        "id": "frameshift.problem-framing.v1",
        "version": "1.0.0",
        "digest": "sha256:9e689e62ff90cc33cf2b520dba9730cd45578ba8898e1a9270b31e94cf7f4951"
      },
      "to": {
        "id": "frameshift.problem-framing.v2",
        "version": "2.0.0",
        "digest": "sha256:bb57c98a14c2fd82ae287787c19cc079266a28160650326df33daf2cd685bea2"
      },
      "actor": {
        "id": "user_owner",
        "kind": "human",
        "role": "decision_owner"
      },
      "session_revision": 1,
      "rationale": "Use the bounded v2 task frame for future executions; retain v1 attribution.",
      "created_at": "2026-09-09T12:00:00Z"
    }
  ],
  "created_at": "2026-09-09T12:01:00Z",
  "state_digest": "sha256:e2ac8ae790500074b0f0558f0e4870cb6b213f67394fb400f38c74d0ab90c9c6",
  "checkpoint_digest": "sha256:ef5f247979832f16efc221d0f31a7ed9a98044baa771fb76f72d324a11feebe6"
}
