{
  "artifacts": [],
  "capability_profile": {
    "adapter": {
      "id": "frameshift.generic",
      "version": "0.1.0"
    },
    "capabilities": [
      {
        "approval": "never",
        "available": true,
        "data_classes": [
          "user-provided"
        ],
        "id": "artifact.read",
        "limitations": [
          "Only artifacts provided in the current context."
        ],
        "operations": [
          "read-inline"
        ],
        "side_effect": "none",
        "version": "1"
      }
    ],
    "profile_id": "generic-conversation-only",
    "schema_version": "1.0.0"
  },
  "checkpoint_digest": "sha256:6ea0b6d5bdf0a2dc0041ee727f7858210a62122a322dcfb686007a1dd777e264",
  "contracts": {
    "engines": {
      "problem_framing": "1.0.0"
    },
    "prompts": {
      "problem_framing": {
        "digest": "sha256:bb57c98a14c2fd82ae287787c19cc079266a28160650326df33daf2cd685bea2",
        "id": "frameshift.problem-framing.v2",
        "version": "2.0.0"
      }
    }
  },
  "created_at": "2026-10-06T09:00:00Z",
  "event_cursor": 10,
  "execution_summaries": [],
  "id": "ckpt_supersession_001",
  "pending_proposals": [],
  "phase": "framing",
  "prior_checkpoint_digest": null,
  "prompt_version_changes": [],
  "schema_version": "2.0.0",
  "session_id": "sess_supersession_001",
  "session_revision": 5,
  "state": {
    "active_frame_id": null,
    "approvals": [
      {
        "actor": {
          "id": "user_lead_eng",
          "kind": "human",
          "role": "decision_owner"
        },
        "created_at": "2026-10-06T09:00:00Z",
        "disposition": "approved",
        "id": "appr_confirm_t0005",
        "profile_id": "approval-profile-frameshift-manual-gui-local-0.1.0",
        "session_revision": 4,
        "target_digest": "sha256:411e56202dcd166d63c7c1c8b4e50959cf97044622484f4eff346daf2e169292",
        "target_id": "stmt_001"
      }
    ],
    "criteria": [],
    "frames": [],
    "graph": {
      "edges": [],
      "nodes": [],
      "schema_version": "1.0.0"
    },
    "id": "sess_supersession_001",
    "options": [],
    "phase": "framing",
    "revision": 5,
    "schema_version": "2.0.0",
    "statements": [
      {
        "id": "stmt_001",
        "primary_role": "observation",
        "provenance": {
          "kind": "observed",
          "source_ids": [
            "intake_t0001"
          ]
        },
        "secondary_roles": [],
        "status": "proposed",
        "text": "My espresso at home is terrible."
      },
      {
        "id": "stmt_002",
        "primary_role": "observation",
        "provenance": {
          "kind": "observed",
          "note": "Typed by the operator during intake.",
          "source_ids": [
            "intake_t0003"
          ]
        },
        "secondary_roles": [],
        "status": "superseded",
        "superseded_by": "stmt_003",
        "text": "The same coffee also tasted bad when brewed at a bar."
      },
      {
        "id": "stmt_003",
        "primary_role": "observation",
        "provenance": {
          "kind": "observed",
          "note": "Typed by the operator during intake.",
          "source_ids": [
            "intake_t0004"
          ]
        },
        "secondary_roles": [],
        "status": "proposed",
        "text": "The bar brewed the same bag with acceptable results."
      }
    ],
    "status": "active",
    "title": "Espresso shots taste wrong at home",
    "workspace_id": "ws_local"
  },
  "state_digest": "sha256:3732dfc966748bd2ed855f9c98408a16074feb30703b3b378166ff4fe1f9f90a"
}
